{
  "procedure_id": "PROC-WND-013",
  "name": "Adhesivo tisular",
  "family": "HERIDAS, PARTES BLANDAS Y ANESTESIA REGIONAL",
  "level": "CORE",
  "schema_version": "1.42",
  "status": "YELLOW",
  "objective": "cerrar una herida superficial simple sin suturas.",
  "indications": [
    "heridas pequeñas, rectas, superficiales y de baja tensión que no requieren cierre profundo."
  ],
  "contraindications_precautions": {
    "unclassified": [
      "infección, mucosa/superficie húmeda, alta tensión, articulación sin inmovilización, proximidad ocular sin protección o lesión profunda de nervio/vaso/tendón/hueso."
    ]
  },
  "equipment": {
    "unclassified": [
      "adhesivo tisular de alta viscosidad si está disponible, protección ocular, gasas y tiras adhesivas opcionales."
    ]
  },
  "anatomy": {
    "unclassified": [
      "epidermis y dermis superficial."
    ]
  },
  "preparation": {
    "unclassified": [
      "limpiar, secar y conseguir hemostasia completa."
    ]
  },
  "steps": [
    {
      "order": 1,
      "action": "aproximar bordes, aplicar pequeñas capas sobre la superficie de la piel extendiéndolas lateralmente sin introducir adhesivo en la herida y mantener aproximación hasta polimerización."
    }
  ],
  "stop_points": [
    "adhesivo dentro del lecho, ojo/mucosa, bordes bajo tensión o sangrado que impida polimerización segura."
  ],
  "confirmation": [
    "bordes unidos sin tensión ni adhesivo intralesional."
  ],
  "complications": {
    "unclassified": [
      "dehiscencia, reacción local, adhesión accidental y lesión térmica por polimerización excesiva."
    ]
  },
  "aftercare": [
    "no aplicar pomada sobre el adhesivo, evitar remojo y dejar que se desprenda espontáneamente."
  ],
  "documentation": [
    "producto/técnica y resultado."
  ],
  "sources": [
    {
      "title": "Merck Manual Professional, How To Repair a Laceration With Tissue Adhesive, updated Jan 2026.",
      "organization": null,
      "year": null
    }
  ],
  "rescue": null,
  "escalation": null,
  "qa": {
    "clinical_qa": "pending",
    "visual_qa": "paused",
    "human_review_required": true,
    "last_updated": null,
    "notes": [
      "YELLOW; revisión humana urgencias pendiente."
    ]
  },
  "aliases": [],
  "provenance": {
    "source_path": "modules/procedures/07-wounds-regional-anesthesia.md",
    "source_heading": "PROC-WND-013 — Adhesivo tisular — CORE",
    "family_preamble": "# 7. Heridas, partes blandas y anestesia regional\n\nEstado de familia: **YELLOW**. Dosis máximas y toxicidad de anestésicos locales se resuelven desde módulos farmacológicos canónicos. Fuentes troncales: emergency wound care, regional anesthesia/POCUS guidance y referencias de mano/quemados.",
    "source_sha256": "335ee98e1a578e3826c5d77931365b74c6992c806a15dd480ec87f0b235f08c3",
    "sections": {
      "Objetivo": "cerrar una herida superficial simple sin suturas.",
      "Indicaciones": "heridas pequeñas, rectas, superficiales y de baja tensión que no requieren cierre profundo.",
      "Contraindicaciones/precauciones": "infección, mucosa/superficie húmeda, alta tensión, articulación sin inmovilización, proximidad ocular sin protección o lesión profunda de nervio/vaso/tendón/hueso.",
      "Material": "adhesivo tisular de alta viscosidad si está disponible, protección ocular, gasas y tiras adhesivas opcionales.",
      "Anatomía": "epidermis y dermis superficial.",
      "Preparación": "limpiar, secar y conseguir hemostasia completa.",
      "Técnica paso a paso": "aproximar bordes, aplicar pequeñas capas sobre la superficie de la piel extendiéndolas lateralmente sin introducir adhesivo en la herida y mantener aproximación hasta polimerización.",
      "STOP": "adhesivo dentro del lecho, ojo/mucosa, bordes bajo tensión o sangrado que impida polimerización segura.",
      "Confirmación": "bordes unidos sin tensión ni adhesivo intralesional.",
      "Complicaciones": "dehiscencia, reacción local, adhesión accidental y lesión térmica por polimerización excesiva.",
      "Después": "no aplicar pomada sobre el adhesivo, evitar remojo y dejar que se desprenda espontáneamente.",
      "Documentación": "producto/técnica y resultado.",
      "Fuentes": "Merck Manual Professional, How To Repair a Laceration With Tissue Adhesive, updated Jan 2026.",
      "QA": "YELLOW; revisión humana urgencias pendiente."
    },
    "safety_excerpts": {
      "rescue": [],
      "escalation": []
    }
  },
  "pending_review": [
    "rescue",
    "escalation"
  ]
}
