{
  "procedure_id": "PROC-WND-007",
  "name": "Irrigación de heridas",
  "family": "HERIDAS, PARTES BLANDAS Y ANESTESIA REGIONAL",
  "level": "CORE",
  "schema_version": "1.42",
  "status": "YELLOW",
  "objective": "reducir suciedad, bacterias y cuerpos extraños antes del cierre o manejo definitivo.",
  "indications": [
    "heridas traumáticas contaminadas o con material visible."
  ],
  "contraindications_precautions": {
    "unclassified": [
      "no dirigir irrigación a alta presión sobre nervios, tendones, vasos, hueso expuesto o cavidades profundas no evaluadas."
    ]
  },
  "equipment": {
    "unclassified": [
      "agua potable limpia o solución salina según contexto, jeringa/sistema de irrigación, recipiente y PPE."
    ]
  },
  "anatomy": {
    "unclassified": [
      "piel, subcutáneo y estructuras profundas expuestas."
    ]
  },
  "preparation": {
    "unclassified": [
      "analgesia adecuada, hemostasia y retirada de contaminantes grandes fácilmente accesibles."
    ]
  },
  "steps": [
    {
      "order": 1,
      "action": "exponer por completo, irrigar de forma copiosa y controlada desde el centro hacia fuera, movilizar suavemente bordes para alcanzar recovecos visibles y retirar detritos sin traumatizar tejidos viables."
    }
  ],
  "stop_points": [
    "sangrado no controlado, lesión profunda crítica o dolor desproporcionado."
  ],
  "confirmation": [
    "lecho visiblemente limpio y ausencia de material macroscópico retenido."
  ],
  "complications": {
    "unclassified": [
      "maceración, dispersión de contaminantes y lesión tisular por presión excesiva."
    ]
  },
  "aftercare": [
    "explorar, desbridar si es necesario y decidir cierre primario, diferido o segunda intención."
  ],
  "documentation": [
    "grado de contaminación, solución/técnica y hallazgos."
  ],
  "sources": [
    {
      "title": "Merck Manual Professional wound cleansing/irrigation references, updated 2025–2026.",
      "organization": null,
      "year": null
    }
  ],
  "rescue": null,
  "escalation": null,
  "qa": {
    "clinical_qa": "pending",
    "visual_qa": "paused",
    "human_review_required": true,
    "last_updated": null,
    "notes": [
      "YELLOW; revisión humana urgencias/cirugía pendiente."
    ]
  },
  "aliases": [],
  "provenance": {
    "source_path": "modules/procedures/07-wounds-regional-anesthesia.md",
    "source_heading": "PROC-WND-007 — Irrigación de heridas — CORE",
    "family_preamble": "# 7. Heridas, partes blandas y anestesia regional\n\nEstado de familia: **YELLOW**. Dosis máximas y toxicidad de anestésicos locales se resuelven desde módulos farmacológicos canónicos. Fuentes troncales: emergency wound care, regional anesthesia/POCUS guidance y referencias de mano/quemados.",
    "source_sha256": "3be0697cbba7e7c3733e75110e292edf945ec7369921789eaa636a265c85e753",
    "sections": {
      "Objetivo": "reducir suciedad, bacterias y cuerpos extraños antes del cierre o manejo definitivo.",
      "Indicaciones": "heridas traumáticas contaminadas o con material visible.",
      "Contraindicaciones/precauciones": "no dirigir irrigación a alta presión sobre nervios, tendones, vasos, hueso expuesto o cavidades profundas no evaluadas.",
      "Material": "agua potable limpia o solución salina según contexto, jeringa/sistema de irrigación, recipiente y PPE.",
      "Anatomía": "piel, subcutáneo y estructuras profundas expuestas.",
      "Preparación": "analgesia adecuada, hemostasia y retirada de contaminantes grandes fácilmente accesibles.",
      "Técnica paso a paso": "exponer por completo, irrigar de forma copiosa y controlada desde el centro hacia fuera, movilizar suavemente bordes para alcanzar recovecos visibles y retirar detritos sin traumatizar tejidos viables.",
      "STOP": "sangrado no controlado, lesión profunda crítica o dolor desproporcionado.",
      "Confirmación": "lecho visiblemente limpio y ausencia de material macroscópico retenido.",
      "Complicaciones": "maceración, dispersión de contaminantes y lesión tisular por presión excesiva.",
      "Después": "explorar, desbridar si es necesario y decidir cierre primario, diferido o segunda intención.",
      "Documentación": "grado de contaminación, solución/técnica y hallazgos.",
      "Fuentes": "Merck Manual Professional wound cleansing/irrigation references, updated 2025–2026.",
      "QA": "YELLOW; revisión humana urgencias/cirugía pendiente."
    },
    "safety_excerpts": {
      "rescue": [],
      "escalation": []
    }
  },
  "pending_review": [
    "rescue",
    "escalation"
  ]
}
