{
  "procedure_id": "PROC-AIR-005",
  "name": "Ventilación bolsa-válvula-mascarilla a un operador",
  "family": "VÍA AÉREA Y VENTILACIÓN",
  "level": "CORE",
  "schema_version": "1.42",
  "status": "YELLOW",
  "objective": "oxigenar y ventilar temporalmente en apnea o ventilación insuficiente.",
  "indications": [
    "apnea, hipoventilación, peri-intubación y reanimación."
  ],
  "contraindications_precautions": {
    "unclassified": [
      "no hay contraindicación absoluta cuando la ventilación es necesaria; técnica deficiente aumenta fuga, insuflación gástrica y aspiración."
    ]
  },
  "equipment": {
    "unclassified": [
      "bolsa autoinflable, mascarilla adecuada, reservorio/oxígeno, filtro, PEEP si está indicada, cánulas y aspiración."
    ]
  },
  "anatomy": {
    "unclassified": [
      "sello nariz-boca, mandíbula y vía aérea superior."
    ]
  },
  "preparation": {
    "unclassified": [
      "optimizar posición, abrir vía aérea y usar adjunct si es necesario."
    ]
  },
  "steps": [
    {
      "order": 1,
      "action": "colocar la mascarilla, realizar agarre C-E elevando la mandíbula y comprimir la bolsa durante aproximadamente 1 segundo, solo hasta producir elevación visible del tórax; reajustar sello/posición si la ventilación es insuficiente."
    }
  ],
  "stop_points": [
    "ausencia de elevación torácica, fuga importante, distensión gástrica o deterioro de oxigenación."
  ],
  "confirmation": [
    "expansión torácica, mejoría clínica/SpO₂ y ETCO₂ si está disponible."
  ],
  "complications": {
    "unclassified": [
      "aspiración, insuflación gástrica, barotrauma e hipoventilación por fuga."
    ]
  },
  "aftercare": [
    "pasar precozmente a técnica a dos operadores o vía avanzada si la ventilación no es adecuada."
  ],
  "documentation": [
    "eficacia, adjuncts utilizados y necesidad de escalada."
  ],
  "sources": [
    {
      "title": "Resuscitation Council UK/ERC Adult Advanced Life Support 2025.",
      "organization": null,
      "year": null
    }
  ],
  "rescue": [
    "reajustar sello/posición si la ventilación es insuficiente."
  ],
  "escalation": [
    "pasar precozmente a técnica a dos operadores o vía avanzada si la ventilación no es adecuada."
  ],
  "qa": {
    "clinical_qa": "pending",
    "visual_qa": "paused",
    "human_review_required": true,
    "last_updated": null,
    "notes": [
      "YELLOW; revisión humana de vía aérea pendiente."
    ]
  },
  "aliases": [],
  "provenance": {
    "source_path": "modules/procedures/01-airway-ventilation.md",
    "source_heading": "PROC-AIR-005 — BVM a un operador — CORE",
    "family_preamble": "# 1. Vía aérea y ventilación\n\nEstado de familia: **YELLOW**. Las dosis, sedación y bloqueantes neuromusculares se resuelven desde módulos farmacológicos canónicos. Fuentes troncales: DAS 2025, SCCM RSI 2023, ERC/RCUK 2025 y recursos NTSP para traqueostomía.",
    "source_sha256": "29fd899604fd13f66908ed6692fc26a38a604d5397655ae0a4feab7f6c192ef1",
    "sections": {
      "Objetivo": "oxigenar y ventilar temporalmente en apnea o ventilación insuficiente.",
      "Indicaciones": "apnea, hipoventilación, peri-intubación y reanimación.",
      "Contraindicaciones/precauciones": "no hay contraindicación absoluta cuando la ventilación es necesaria; técnica deficiente aumenta fuga, insuflación gástrica y aspiración.",
      "Material": "bolsa autoinflable, mascarilla adecuada, reservorio/oxígeno, filtro, PEEP si está indicada, cánulas y aspiración.",
      "Anatomía": "sello nariz-boca, mandíbula y vía aérea superior.",
      "Preparación": "optimizar posición, abrir vía aérea y usar adjunct si es necesario.",
      "Técnica paso a paso": "colocar la mascarilla, realizar agarre C-E elevando la mandíbula y comprimir la bolsa durante aproximadamente 1 segundo, solo hasta producir elevación visible del tórax; reajustar sello/posición si la ventilación es insuficiente.",
      "STOP": "ausencia de elevación torácica, fuga importante, distensión gástrica o deterioro de oxigenación.",
      "Confirmación": "expansión torácica, mejoría clínica/SpO₂ y ETCO₂ si está disponible.",
      "Complicaciones": "aspiración, insuflación gástrica, barotrauma e hipoventilación por fuga.",
      "Después": "pasar precozmente a técnica a dos operadores o vía avanzada si la ventilación no es adecuada.",
      "Documentación": "eficacia, adjuncts utilizados y necesidad de escalada.",
      "Fuentes": "Resuscitation Council UK/ERC Adult Advanced Life Support 2025.",
      "QA": "YELLOW; revisión humana de vía aérea pendiente."
    },
    "safety_excerpts": {
      "rescue": [
        {
          "section": "Técnica paso a paso",
          "quote": "reajustar sello/posición si la ventilación es insuficiente."
        }
      ],
      "escalation": [
        {
          "section": "Después",
          "quote": "pasar precozmente a técnica a dos operadores o vía avanzada si la ventilación no es adecuada."
        }
      ]
    }
  },
  "pending_review": []
}
